{
  "categories": [
    {
      "accounting": {
        "arithmeticClosed": true,
        "excludedRecords": 0,
        "inScopeRecords": 21,
        "inputRecords": 1431,
        "outOfScopeRecords": 1410,
        "retainedRecords": 21,
        "unresolvedRecords": 0
      },
      "candidateCount": 10,
      "capturedAt": "2026-10-04T22:50:00+00:00",
      "categoryId": "asg_emergency_purchase_source_native",
      "metricType": "ASG_EMERGENCY_PURCHASE_COST",
      "rows": [
        {
          "canonicalEntityId": null,
          "controlNumbers": [
            "26-ASG-AAA-0028"
          ],
          "currency": "USD",
          "entityDisplayName": "Sonnell Truck Center LLC",
          "entityId": "asg_licitador_id:23388",
          "entityResolutionState": "SOURCE_NATIVE_ASG_LICITADOR_ID",
          "entityType": "asg_supplier",
          "financialValueState": "MEASURED_ASG_EMERGENCY_PURCHASE_COST",
          "metricType": "ASG_EMERGENCY_PURCHASE_COST",
          "metricValue": 1744085,
          "rank": 1,
          "recordCount": 1,
          "sourceDisplayNames": [
            "Sonnell Truck Center LLC"
          ]
        },
        {
          "canonicalEntityId": null,
          "controlNumbers": [
            "26-ASG-AAA-0008",
            "26-ASG-AAA-0016"
          ],
          "currency": "USD",
          "entityDisplayName": "Duenas Leasing LLC",
          "entityId": "asg_licitador_id:56227",
          "entityResolutionState": "SOURCE_NATIVE_ASG_LICITADOR_ID",
          "entityType": "asg_supplier",
          "financialValueState": "MEASURED_ASG_EMERGENCY_PURCHASE_COST",
          "metricType": "ASG_EMERGENCY_PURCHASE_COST",
          "metricValue": 1474425,
          "rank": 2,
          "recordCount": 2,
          "sourceDisplayNames": [
            "Duenas Leasing LLC"
          ]
        },
        {
          "canonicalEntityId": null,
          "controlNumbers": [
            "26-ASG-AAA-0007",
            "26-ASG-AAA-0014",
            "26-ASG-AAA-0024",
            "26-ASG-AAA-0025"
          ],
          "currency": "USD",
          "entityDisplayName": "La Casa del Camionero",
          "entityId": "asg_licitador_id:10329",
          "entityResolutionState": "SOURCE_NATIVE_ASG_LICITADOR_ID",
          "entityType": "asg_supplier",
          "financialValueState": "MEASURED_ASG_EMERGENCY_PURCHASE_COST",
          "metricType": "ASG_EMERGENCY_PURCHASE_COST",
          "metricValue": 297908.8,
          "rank": 3,
          "recordCount": 4,
          "sourceDisplayNames": [
            "La Casa del Camionero",
            "La Casa del Camionero, Inc."
          ]
        },
        {
          "canonicalEntityId": null,
          "controlNumbers": [
            "26-ASG-AAA-0001",
            "26-ASG-AAA-0002",
            "26-ASG-AAA-0003",
            "26-ASG-AAA-0004",
            "26-ASG-AAA-0005",
            "26-ASG-AAA-0009",
            "26-ASG-AAA-0010"
          ],
          "currency": "USD",
          "entityDisplayName": "A1 Generator Services Incorporated",
          "entityId": "asg_licitador_id:28546",
          "entityResolutionState": "SOURCE_NATIVE_ASG_LICITADOR_ID",
          "entityType": "asg_supplier",
          "financialValueState": "MEASURED_ASG_EMERGENCY_PURCHASE_COST",
          "metricType": "ASG_EMERGENCY_PURCHASE_COST",
          "metricValue": 293629.35,
          "rank": 4,
          "recordCount": 7,
          "sourceDisplayNames": [
            "A1 Generator Services Incorporated"
          ]
        },
        {
          "canonicalEntityId": null,
          "controlNumbers": [
            "26-ASG-AAA-0011"
          ],
          "currency": "USD",
          "entityDisplayName": "Autos Vega Inc.",
          "entityId": "asg_licitador_id:1174",
          "entityResolutionState": "SOURCE_NATIVE_ASG_LICITADOR_ID",
          "entityType": "asg_supplier",
          "financialValueState": "MEASURED_ASG_EMERGENCY_PURCHASE_COST",
          "metricType": "ASG_EMERGENCY_PURCHASE_COST",
          "metricValue": 278050,
          "rank": 5,
          "recordCount": 1,
          "sourceDisplayNames": [
            "Autos Vega Inc."
          ]
        },
        {
          "canonicalEntityId": null,
          "controlNumbers": [
            "26-ASG-AAA-0017",
            "26-ASG-AAA-0029"
          ],
          "currency": "USD",
          "entityDisplayName": "Teselta LLC",
          "entityId": "asg_licitador_id:303",
          "entityResolutionState": "SOURCE_NATIVE_ASG_LICITADOR_ID",
          "entityType": "asg_supplier",
          "financialValueState": "MEASURED_ASG_EMERGENCY_PURCHASE_COST",
          "metricType": "ASG_EMERGENCY_PURCHASE_COST",
          "metricValue": 187180,
          "rank": 6,
          "recordCount": 2,
          "sourceDisplayNames": [
            "Teselta LLC"
          ]
        },
        {
          "canonicalEntityId": null,
          "controlNumbers": [
            "26-ASG-AAA-0027"
          ],
          "currency": "USD",
          "entityDisplayName": "Mendez & Co.",
          "entityId": "asg_licitador_id:437",
          "entityResolutionState": "SOURCE_NATIVE_ASG_LICITADOR_ID",
          "entityType": "asg_supplier",
          "financialValueState": "MEASURED_ASG_EMERGENCY_PURCHASE_COST",
          "metricType": "ASG_EMERGENCY_PURCHASE_COST",
          "metricValue": 71003.52,
          "rank": 7,
          "recordCount": 1,
          "sourceDisplayNames": [
            "Mendez & Co."
          ]
        },
        {
          "canonicalEntityId": null,
          "controlNumbers": [
            "26-ASG-AAA-0033"
          ],
          "currency": "USD",
          "entityDisplayName": "Caribbean Composting Inc.",
          "entityId": "asg_licitador_id:4381",
          "entityResolutionState": "SOURCE_NATIVE_ASG_LICITADOR_ID",
          "entityType": "asg_supplier",
          "financialValueState": "MEASURED_ASG_EMERGENCY_PURCHASE_COST",
          "metricType": "ASG_EMERGENCY_PURCHASE_COST",
          "metricValue": 47200,
          "rank": 8,
          "recordCount": 1,
          "sourceDisplayNames": [
            "Caribbean Composting Inc."
          ]
        },
        {
          "canonicalEntityId": null,
          "controlNumbers": [
            "26-ASG-AAA-0031"
          ],
          "currency": "USD",
          "entityDisplayName": "ALL GREEN CLEANING & MAINTENANCE, LLC",
          "entityId": "asg_licitador_id:13947",
          "entityResolutionState": "SOURCE_NATIVE_ASG_LICITADOR_ID",
          "entityType": "asg_supplier",
          "financialValueState": "MEASURED_ASG_EMERGENCY_PURCHASE_COST",
          "metricType": "ASG_EMERGENCY_PURCHASE_COST",
          "metricValue": 20624.4,
          "rank": 9,
          "recordCount": 1,
          "sourceDisplayNames": [
            "ALL GREEN CLEANING & MAINTENANCE, LLC"
          ]
        },
        {
          "canonicalEntityId": null,
          "controlNumbers": [
            "26-ASG-AAA-0030"
          ],
          "currency": "USD",
          "entityDisplayName": "Almacen El Ahorro LLC",
          "entityId": "asg_licitador_id:25833",
          "entityResolutionState": "SOURCE_NATIVE_ASG_LICITADOR_ID",
          "entityType": "asg_supplier",
          "financialValueState": "MEASURED_ASG_EMERGENCY_PURCHASE_COST",
          "metricType": "ASG_EMERGENCY_PURCHASE_COST",
          "metricValue": 9558.75,
          "rank": 10,
          "recordCount": 1,
          "sourceDisplayNames": [
            "Almacen El Ahorro LLC"
          ]
        }
      ],
      "runtimeManifest": {
        "files": [
          {
            "bytes": 8047,
            "path": "config/financial_category_ontology.json",
            "sha256": "d629c73df3bd4d4bb0e335952398c19999c40886601cbce551d440f8c98728fa"
          },
          {
            "bytes": 9145,
            "path": "server/backend/leaderboards.py",
            "sha256": "1fdfe50ad0e127cb26662f96b11a957cfe2357e9edc255436bd2b31e489b9e04"
          },
          {
            "bytes": 38763,
            "path": "server/backend/leaderboard_adapters.py",
            "sha256": "6746ef5725ce7f7b1e3ddd87b213b3575001c8560cb1e2daaf407c1cd260c596"
          },
          {
            "bytes": 10795,
            "path": "server/backend/leaderboard_history.py",
            "sha256": "7166897277f24359b3d3dfde88772b556669845d1542c8d9a877a7c1ffee1f74"
          },
          {
            "bytes": 5939,
            "path": "server/backend/leaderboard_investigation.py",
            "sha256": "d5a68c990488436a9c068e0fb61a1f7c7b5efaf2ea312160a583867b063201c1"
          },
          {
            "bytes": 6125,
            "path": "server/backend/leaderboard_entities.py",
            "sha256": "7a3b01c880876116333e4f4e57a29374a128a8f488b64115d04d99a1c77bb6f5"
          }
        ],
        "packages": {
          "fastapi": "0.142.2",
          "pandas": "3.0.6",
          "pydantic": "2.13.5"
        },
        "platform": "Linux-6.1.166-24.303.amzn2023.aarch64-aarch64-with-glibc2.36",
        "producerCommit": "e963f4258a78c9b30427df7a7e9b4edf83f00692",
        "python": "3.11.2",
        "state": "FROZEN"
      },
      "snapshotCertification": {
        "certifiedAt": "2026-10-04T22:55:00+00:00",
        "ciExecutionPolicy": {
          "assertsPass": false,
          "blocking": false,
          "state": "WAIVED_BY_USER"
        },
        "scopeId": "moneysweep.leaderboard.asg-emergency-source-native-v1",
        "sourceSnapshotSha256": "bcbb29172d44d49efc45661acf4669197ebfdad544b9fa03f93b450ec86e2115",
        "state": "PASS",
        "zeroMaterialUnresolvedResidue": true
      },
      "snapshotId": "asg-emergency-source-native:20261004-terminal",
      "snapshotSha256": "75279050e1fc7fa395ce25004eadd3fab6323a48bb5d3edebef23d36f3c4ea18",
      "sourceManifestations": [
        {
          "bytes": 4823,
          "modifiedAt": "2026-10-04T22:27:28+00:00",